screen_name,created_at,id,id_str,text,full_text,truncated,entities,source,in_reply_to_status_id,in_reply_to_status_id_str,in_reply_to_user_id,in_reply_to_user_id_str,in_reply_to_screen_name,geo,coordinates,place,contributors,is_quote_status,retweet_count,favorite_count,favorited,favorited_by,retweeted,scopes,lang,possibly_sensitive,display_text_width,display_text_range,retweeted_status,quoted_status,quoted_status_id,quoted_status_id_str,quoted_status_permalink,quote_count,timestamp_ms,reply_count,filter_level,metadata,query,withheld_scope,withheld_copyright,withheld_in_countries,possibly_sensitive_appealable
elcomerciocom,2023-02-03T20:08:54Z,1621601642389938200,1621601642389938176,En febrero la Revisión Técnica Vehicular corresponde al dígito de la placa terminada en 1 » https://t.co/QcJMqEXqsX https://t.co/Imbm1M61zv,En febrero la Revisión Técnica Vehicular corresponde al dígito de la placa terminada en 1 » https://t.co/QcJMqEXqsX https://t.co/Imbm1M61zv,FALSE,,"<a href=""https://about.twitter.com/products/tweetdeck"" rel=""nofollow"">TweetDeck</a>",NA,NA,NA,NA,NA,,,,NA,FALSE,0,2,FALSE,NA,FALSE,NA,es,FALSE,NA,115,NA,,NA,NA,NA,NA,NA,NA,NA,NA,NA,NA,NA,NA,NA
elcomerciocom,2023-02-03T19:01:53Z,1621584777731088400,1621584777731088384,Cristiano Ronaldo anota su primer gol con Al-Nassr y aumenta su récord https://t.co/2Reb7lwH7x,Cristiano Ronaldo anota su primer gol con Al-Nassr y aumenta su récord https://t.co/2Reb7lwH7x,FALSE,,"<a href=""https://mobile.twitter.com"" rel=""nofollow"">Twitter Web App</a>",NA,NA,NA,NA,NA,,,,NA,FALSE,3,8,FALSE,NA,FALSE,NA,es,FALSE,NA,94,NA,,NA,NA,NA,NA,NA,NA,NA,NA,NA,NA,NA,NA,NA
elcomerciocom,2023-02-03T18:59:46Z,1621584244332961800,1621584244332961792,"Encapuchados dispararon a las víctimas dentro de una casa en Nueva Prosperina, #Guayaquil » https://t.co/pRbmUxvPOO https://t.co/ufUjKRrgg1","Encapuchados dispararon a las víctimas dentro de una casa en Nueva Prosperina, #Guayaquil » https://t.co/pRbmUxvPOO https://t.co/ufUjKRrgg1",FALSE,,"<a href=""https://mobile.twitter.com"" rel=""nofollow"">Twitter Web App</a>",NA,NA,NA,NA,NA,,,,NA,FALSE,4,14,FALSE,NA,FALSE,NA,es,FALSE,NA,115,NA,,NA,NA,NA,NA,NA,NA,NA,NA,NA,NA,NA,NA,NA
elcomerciocom,2023-02-03T18:55:00Z,1621583045420613600,1621583045420613635,#EleccionesEC2023 | Registro Civil atenderá el fin de semana en #Quito. Mire los horarios del sábado 4 y domingo 5 de febrero » https://t.co/kpAGWr8Wc0 https://t.co/EcPtfV9zWy,#EleccionesEC2023 | Registro Civil atenderá el fin de semana en #Quito. Mire los horarios del sábado 4 y domingo 5 de febrero » https://t.co/kpAGWr8Wc0 https://t.co/EcPtfV9zWy,FALSE,,"<a href=""https://mobile.twitter.com"" rel=""nofollow"">Twitter Web App</a>",NA,NA,NA,NA,NA,,,,NA,FALSE,11,24,FALSE,NA,FALSE,NA,es,FALSE,NA,151,NA,,NA,NA,NA,NA,NA,NA,NA,NA,NA,NA,NA,NA,NA
elcomerciocom,2023-02-03T17:53:54Z,1621567670813327400,1621567670813327360,#Quito | El vehículo arrolló a un peatón en la Panamericana Norte » https://t.co/iPrqgXefds https://t.co/slLkKWvf6L,#Quito | El vehículo arrolló a un peatón en la Panamericana Norte » https://t.co/iPrqgXefds https://t.co/slLkKWvf6L,FALSE,,"<a href=""https://mobile.twitter.com"" rel=""nofollow"">Twitter Web App</a>",NA,NA,NA,NA,NA,,,,NA,FALSE,13,39,FALSE,NA,FALSE,NA,es,FALSE,NA,91,NA,,NA,NA,NA,NA,NA,NA,NA,NA,NA,NA,NA,NA,NA
elcomerciocom,2023-02-03T17:30:57Z,1621561895005159400,1621561895005159429,Ecuador se enfrenta a Uruguay en el Sub 20. ¿Dónde ver el partido? https://t.co/fsBdCr4eTf,Ecuador se enfrenta a Uruguay en el Sub 20. ¿Dónde ver el partido? https://t.co/fsBdCr4eTf,FALSE,,"<a href=""https://mobile.twitter.com"" rel=""nofollow"">Twitter Web App</a>",NA,NA,NA,NA,NA,,,,NA,FALSE,5,7,FALSE,NA,FALSE,NA,es,FALSE,NA,90,NA,,NA,NA,NA,NA,NA,NA,NA,NA,NA,NA,NA,NA,NA
elcomerciocom,2023-02-03T17:00:37Z,1621554262357545e3,1621554262357544960,¡Evite sanciones! 🍺❌ Desde las 12:00 de este viernes 3 de febrero rige la #LeySeca en #Ecuador por las #EleccionesEC2023 » https://t.co/brLYhCSVYo https://t.co/43U8thhZYp,¡Evite sanciones! 🍺❌ Desde las 12:00 de este viernes 3 de febrero rige la #LeySeca en #Ecuador por las #EleccionesEC2023 » https://t.co/brLYhCSVYo https://t.co/43U8thhZYp,FALSE,,"<a href=""https://mobile.twitter.com"" rel=""nofollow"">Twitter Web App</a>",NA,NA,NA,NA,NA,,,,NA,FALSE,4,25,FALSE,NA,FALSE,NA,es,FALSE,NA,146,NA,,NA,NA,NA,NA,NA,NA,NA,NA,NA,NA,NA,NA,NA
elcomerciocom,2023-02-03T16:35:27Z,1621547928446713900,1621547928446713859,El volcán #Cotopaxi mantiene emisiones continuas de gases y ceniza en el inicio de febrero de 2023 » https://t.co/rnSQx7rV6L https://t.co/9lFoVQzIJY,El volcán #Cotopaxi mantiene emisiones continuas de gases y ceniza en el inicio de febrero de 2023 » https://t.co/rnSQx7rV6L https://t.co/9lFoVQzIJY,FALSE,,"<a href=""https://mobile.twitter.com"" rel=""nofollow"">Twitter Web App</a>",NA,NA,NA,NA,NA,,,,NA,FALSE,10,20,FALSE,NA,FALSE,NA,es,FALSE,NA,124,NA,,NA,NA,NA,NA,NA,NA,NA,NA,NA,NA,NA,NA,NA
elcomerciocom,2023-02-03T16:26:43Z,1621545728412713e3,1621545728412712961,Las #EleccionesEC2023 alteran la movilidad en #Quito. Cierres viales se realizarán desde el sábado 4 de febrero » https://t.co/zuoFBrn9k2 https://t.co/77u0xWiBnR,Las #EleccionesEC2023 alteran la movilidad en #Quito. Cierres viales se realizarán desde el sábado 4 de febrero » https://t.co/zuoFBrn9k2 https://t.co/77u0xWiBnR,FALSE,,"<a href=""https://mobile.twitter.com"" rel=""nofollow"">Twitter Web App</a>",NA,NA,NA,NA,NA,,,,NA,FALSE,2,11,FALSE,NA,FALSE,NA,es,FALSE,NA,137,NA,,NA,NA,NA,NA,NA,NA,NA,NA,NA,NA,NA,NA,NA
elcomerciocom,2023-02-03T15:37:04Z,1621533234340266e3,1621533234340265985,#Cuenca | El estudiante fue parte de un enfrentamiento a golpes en la vía pública. Educación se pronuncia » https://t.co/MnYJqVPpar https://t.co/ecgR7wxabZ,#Cuenca | El estudiante fue parte de un enfrentamiento a golpes en la vía pública. Educación se pronuncia » https://t.co/MnYJqVPpar https://t.co/ecgR7wxabZ,FALSE,,"<a href=""https://mobile.twitter.com"" rel=""nofollow"">Twitter Web App</a>",NA,NA,NA,NA,NA,,,,NA,FALSE,6,30,FALSE,NA,FALSE,NA,es,FALSE,NA,131,NA,,NA,NA,NA,NA,NA,NA,NA,NA,NA,NA,NA,NA,NA
elcomerciocom,2023-02-03T15:30:14Z,1621531513945788400,1621531513945788418,¿Qué falta para que Gareca se una a la Selección de Ecuador? https://t.co/xfgEpQ95sC,¿Qué falta para que Gareca se una a la Selección de Ecuador? https://t.co/xfgEpQ95sC,FALSE,,"<a href=""https://mobile.twitter.com"" rel=""nofollow"">Twitter Web App</a>",NA,NA,NA,NA,NA,,,,NA,FALSE,2,4,FALSE,NA,FALSE,NA,es,FALSE,NA,84,NA,,NA,NA,NA,NA,NA,NA,NA,NA,NA,NA,NA,NA,NA
elcomerciocom,2023-02-03T15:19:35Z,1621528836407001e3,1621528836407001092,"#ATENCIÓN | La Policía recupera vehículo de alta gama que causó muerte en av. Panamericana Norte, en #Quito » https://t.co/852kzztvmR https://t.co/uGPHOYJ8bf","#ATENCIÓN | La Policía recupera vehículo de alta gama que causó muerte en av. Panamericana Norte, en #Quito » https://t.co/852kzztvmR https://t.co/uGPHOYJ8bf",FALSE,,"<a href=""https://mobile.twitter.com"" rel=""nofollow"">Twitter Web App</a>",NA,NA,NA,NA,NA,,,,NA,FALSE,51,190,FALSE,NA,FALSE,NA,es,FALSE,NA,133,NA,,NA,NA,NA,NA,NA,NA,NA,NA,NA,NA,NA,NA,NA
elcomerciocom,2023-02-03T14:21:23Z,"1,62E+34",1621514188119216128,El diseñador Paco Rabanne murió en Francia a los 88 años » https://t.co/pDV0hC0K7j https://t.co/RMQOf25cO5,El diseñador Paco Rabanne murió en Francia a los 88 años » https://t.co/pDV0hC0K7j https://t.co/RMQOf25cO5,FALSE,,"<a href=""https://mobile.twitter.com"" rel=""nofollow"">Twitter Web App</a>",NA,NA,NA,NA,NA,,,,NA,FALSE,28,96,FALSE,NA,FALSE,NA,es,FALSE,NA,82,NA,,NA,NA,NA,NA,NA,NA,NA,NA,NA,NA,NA,NA,NA
elcomerciocom,2023-02-03T14:03:48Z,1621509762637783e3,1621509762637783050,El Pentágono sigue de cerca los movimientos del globo que sobrevuela Estados Unidos » https://t.co/xkqDWn9DcL https://t.co/cYgMMdLT1d,El Pentágono sigue de cerca los movimientos del globo que sobrevuela Estados Unidos » https://t.co/xkqDWn9DcL https://t.co/cYgMMdLT1d,FALSE,,"<a href=""https://mobile.twitter.com"" rel=""nofollow"">Twitter Web App</a>",NA,NA,NA,NA,NA,,,,NA,FALSE,10,43,FALSE,NA,FALSE,NA,es,FALSE,NA,109,NA,,NA,NA,NA,NA,NA,NA,NA,NA,NA,NA,NA,NA,NA
elcomerciocom,2023-02-03T13:53:58Z,1621507290657624e3,1621507290657624065,Agenda de partidos de los futbolistas ecuatorianos en Europa https://t.co/qBA0DINJKn,Agenda de partidos de los futbolistas ecuatorianos en Europa https://t.co/qBA0DINJKn,FALSE,,"<a href=""https://mobile.twitter.com"" rel=""nofollow"">Twitter Web App</a>",NA,NA,NA,NA,NA,,,,NA,FALSE,4,4,FALSE,NA,FALSE,NA,es,FALSE,NA,84,NA,,NA,NA,NA,NA,NA,NA,NA,NA,NA,NA,NA,NA,NA
elcomerciocom,2023-02-03T13:33:42Z,1621502189221941200,1621502189221941249,La Secretaría de Riesgos dice que la #ceniza del volcán Cotopaxi se dirige al norte y sur de #Ecuador » https://t.co/NRdMgxV0Wi https://t.co/zkQDQpVoiE,La Secretaría de Riesgos dice que la #ceniza del volcán Cotopaxi se dirige al norte y sur de #Ecuador » https://t.co/NRdMgxV0Wi https://t.co/zkQDQpVoiE,FALSE,,"<a href=""https://mobile.twitter.com"" rel=""nofollow"">Twitter Web App</a>",NA,NA,NA,NA,NA,,,,NA,FALSE,11,43,FALSE,NA,FALSE,NA,es,FALSE,NA,127,NA,,NA,NA,NA,NA,NA,NA,NA,NA,NA,NA,NA,NA,NA
elcomerciocom,2023-02-03T13:28:47Z,1621500951772135400,1621500951772135424,#ElPro | Ricardo Adé fue uno de los pilares del histórico campeonato de #Aucas » https://t.co/qVDOz0y7Lw https://t.co/CEZfhaVECE,#ElPro | Ricardo Adé fue uno de los pilares del histórico campeonato de #Aucas » https://t.co/qVDOz0y7Lw https://t.co/CEZfhaVECE,FALSE,,"<a href=""https://mobile.twitter.com"" rel=""nofollow"">Twitter Web App</a>",NA,NA,NA,NA,NA,,,,NA,FALSE,6,68,FALSE,NA,FALSE,NA,es,FALSE,NA,104,NA,,NA,NA,NA,NA,NA,NA,NA,NA,NA,NA,NA,NA,NA
elcomerciocom,2023-02-03T13:01:14Z,1621494017136394200,1621494017136394240,El hecho ocurrió en Santo Domingo de los Tsáchilas tras una persecución » https://t.co/92roUxeiHB https://t.co/rDJuVXZ7SK,El hecho ocurrió en Santo Domingo de los Tsáchilas tras una persecución » https://t.co/92roUxeiHB https://t.co/rDJuVXZ7SK,FALSE,,"<a href=""https://mobile.twitter.com"" rel=""nofollow"">Twitter Web App</a>",NA,NA,NA,NA,NA,,,,NA,FALSE,127,1162,FALSE,NA,FALSE,NA,es,FALSE,NA,97,NA,,NA,NA,NA,NA,NA,NA,NA,NA,NA,NA,NA,NA,NA
elcomerciocom,2023-02-03T12:29:57Z,1621486144574603300,1621486144574603266,China reacciona a acusación del Pentágono sobre globo espía y pide 'no especular' https://t.co/SceIoeIVvI,China reacciona a acusación del Pentágono sobre globo espía y pide 'no especular' https://t.co/SceIoeIVvI,FALSE,,"<a href=""https://mobile.twitter.com"" rel=""nofollow"">Twitter Web App</a>",NA,NA,NA,NA,NA,,,,NA,FALSE,3,8,FALSE,NA,FALSE,NA,es,FALSE,NA,105,NA,,NA,NA,NA,NA,NA,NA,NA,NA,NA,NA,NA,NA,NA
elcomerciocom,2023-02-03T12:24:24Z,1621484750522155e3,1621484750522155013,#EleccionesEC2023 | El Ministerio de Educación anuncia medidas para planteles fiscales y particulares para este viernes 3 de febrero » https://t.co/yRSIuxFY1V https://t.co/8IVamlfAah,#EleccionesEC2023 | El Ministerio de Educación anuncia medidas para planteles fiscales y particulares para este viernes 3 de febrero » https://t.co/yRSIuxFY1V https://t.co/8IVamlfAah,FALSE,,"<a href=""https://mobile.twitter.com"" rel=""nofollow"">Twitter Web App</a>",NA,NA,NA,NA,NA,,,,NA,FALSE,3,19,FALSE,NA,FALSE,NA,es,FALSE,NA,158,NA,,NA,NA,NA,NA,NA,NA,NA,NA,NA,NA,NA,NA,NA
elcomerciocom,2023-02-03T12:00:17Z,1621478680420667400,1621478680420667392,#Quito | La Planta de Tratamiento El Troje ampliará su capacidad https://t.co/IWtPxmzedT,#Quito | La Planta de Tratamiento El Troje ampliará su capacidad https://t.co/IWtPxmzedT,FALSE,,"<a href=""https://mobile.twitter.com"" rel=""nofollow"">Twitter Web App</a>",NA,NA,NA,NA,NA,,,,NA,FALSE,2,6,FALSE,NA,FALSE,NA,es,FALSE,NA,88,NA,,NA,NA,NA,NA,NA,NA,NA,NA,NA,NA,NA,NA,NA
elcomerciocom,2023-02-03T11:31:20Z,1621471394671345700,1621471394671345664,Pico y placa en #Quito: restricciones para este viernes 3 de febrero » https://t.co/uElQfJAdpO https://t.co/moHR6VCcE3,Pico y placa en #Quito: restricciones para este viernes 3 de febrero » https://t.co/uElQfJAdpO https://t.co/moHR6VCcE3,FALSE,,"<a href=""https://mobile.twitter.com"" rel=""nofollow"">Twitter Web App</a>",NA,NA,NA,NA,NA,,,,NA,FALSE,5,19,FALSE,NA,FALSE,NA,es,FALSE,NA,94,NA,,NA,NA,NA,NA,NA,NA,NA,NA,NA,NA,NA,NA,NA
elcomerciocom,2023-02-03T03:08:05Z,1621344746076602400,1621344746076602369,Wilson Erazo se suma a la lista de candidatos que han sufrido atentados »  https://t.co/q9fKpdmkgR https://t.co/yyMcP0TByo,Wilson Erazo se suma a la lista de candidatos que han sufrido atentados »  https://t.co/q9fKpdmkgR https://t.co/yyMcP0TByo,FALSE,,"<a href=""https://about.twitter.com/products/tweetdeck"" rel=""nofollow"">TweetDeck</a>",NA,NA,NA,NA,NA,,,,NA,FALSE,8,31,FALSE,NA,FALSE,NA,es,FALSE,NA,98,NA,,NA,NA,NA,NA,NA,NA,NA,NA,NA,NA,NA,NA,NA
elcomerciocom,2023-02-03T03:02:00Z,1621343215461843e3,1621343215461842949,Bobi tiene 30 años y vive en Portugal » https://t.co/OZgL5nBFYo https://t.co/cADKoNILWV,Bobi tiene 30 años y vive en Portugal » https://t.co/OZgL5nBFYo https://t.co/cADKoNILWV,FALSE,,"<a href=""https://about.twitter.com/products/tweetdeck"" rel=""nofollow"">TweetDeck</a>",NA,NA,NA,NA,NA,,,,NA,FALSE,24,266,FALSE,NA,FALSE,NA,es,FALSE,NA,63,NA,,NA,NA,NA,NA,NA,NA,NA,NA,NA,NA,NA,NA,NA
elcomerciocom,2023-02-03T02:41:10Z,1621337973085061e3,1621337973085061121,#WhatsApp permitirá hacer llamadas desde la pantalla de inicio del celular https://t.co/KovTUoux3t,#WhatsApp permitirá hacer llamadas desde la pantalla de inicio del celular https://t.co/KovTUoux3t,FALSE,,"<a href=""https://about.twitter.com/products/tweetdeck"" rel=""nofollow"">TweetDeck</a>",NA,NA,NA,NA,NA,,,,NA,FALSE,1,7,FALSE,NA,FALSE,NA,es,FALSE,NA,98,NA,,NA,NA,NA,NA,NA,NA,NA,NA,NA,NA,NA,NA,NA
elcomerciocom,2023-02-03T02:40:36Z,1621337831535775700,1621337831535775744,Michelle #Carvalho anunció que realizará una transmisión en vivo para desenmascarar a #Piqué » https://t.co/FZwLe6X4tp https://t.co/aWs99iuOxV,Michelle #Carvalho anunció que realizará una transmisión en vivo para desenmascarar a #Piqué » https://t.co/FZwLe6X4tp https://t.co/aWs99iuOxV,FALSE,,"<a href=""https://about.twitter.com/products/tweetdeck"" rel=""nofollow"">TweetDeck</a>",NA,NA,NA,NA,NA,,,,NA,FALSE,6,31,FALSE,NA,FALSE,NA,es,FALSE,NA,118,NA,,NA,NA,NA,NA,NA,NA,NA,NA,NA,NA,NA,NA,NA
elcomerciocom,2023-02-03T02:00:00Z,1621327613259022300,1621327613259022338,#MetrodeQuito informó que los viajes gratuitos se suspenderán desde este viernes 3 de febrero de 2023 » https://t.co/QnmAWeOPKr https://t.co/sEGlJK9iTv,#MetrodeQuito informó que los viajes gratuitos se suspenderán desde este viernes 3 de febrero de 2023 » https://t.co/QnmAWeOPKr https://t.co/sEGlJK9iTv,FALSE,,"<a href=""https://about.twitter.com/products/tweetdeck"" rel=""nofollow"">TweetDeck</a>",NA,NA,NA,NA,NA,,,,NA,FALSE,13,34,FALSE,NA,FALSE,NA,es,FALSE,NA,127,NA,,NA,NA,NA,NA,NA,NA,NA,NA,NA,NA,NA,NA,NA
elcomerciocom,2023-02-03T01:30:00Z,1621320062811476e3,1621320062811475968,El 5 de febrero se desarrollarán las #EleccionesEC2023 a nivel nacional » https://t.co/z012rPybQg https://t.co/HdJMV94j3R,El 5 de febrero se desarrollarán las #EleccionesEC2023 a nivel nacional » https://t.co/z012rPybQg https://t.co/HdJMV94j3R,FALSE,,"<a href=""https://about.twitter.com/products/tweetdeck"" rel=""nofollow"">TweetDeck</a>",NA,NA,NA,NA,NA,,,,NA,FALSE,7,30,FALSE,NA,FALSE,NA,es,FALSE,NA,97,NA,,NA,NA,NA,NA,NA,NA,NA,NA,NA,NA,NA,NA,NA
elcomerciocom,2023-02-03T01:00:01Z,1621312518068080600,1621312518068080642,El delantero ecuatoriano suma 20 goles en 18 partidos 🇪🇨 https://t.co/agvX3gJ07t https://t.co/SRGpSHbJhg,El delantero ecuatoriano suma 20 goles en 18 partidos 🇪🇨 https://t.co/agvX3gJ07t https://t.co/SRGpSHbJhg,FALSE,,"<a href=""https://about.twitter.com/products/tweetdeck"" rel=""nofollow"">TweetDeck</a>",NA,NA,NA,NA,NA,,,,NA,FALSE,60,579,FALSE,NA,FALSE,NA,es,FALSE,NA,80,NA,,NA,NA,NA,NA,NA,NA,NA,NA,NA,NA,NA,NA,NA
elcomerciocom,2023-02-03T00:30:00Z,1621304964764295200,1621304964764295168,¿Qué le pasó al joven mexicano?🏋🏻‍♂️ » https://t.co/unN99U5qEV https://t.co/Cat8PdqSy8,¿Qué le pasó al joven mexicano?🏋🏻‍♂️ » https://t.co/unN99U5qEV https://t.co/Cat8PdqSy8,FALSE,,"<a href=""https://about.twitter.com/products/tweetdeck"" rel=""nofollow"">TweetDeck</a>",NA,NA,NA,NA,NA,,,,NA,FALSE,21,131,FALSE,NA,FALSE,NA,es,FALSE,NA,62,NA,,NA,NA,NA,NA,NA,NA,NA,NA,NA,NA,NA,NA,NA
elcomerciocom,2023-02-03T00:00:01Z,1621297418078658600,1621297418078658566,"La muerte del bebé se registró en El Fortín, noroeste de #Guayaquil » https://t.co/q5o0drovML https://t.co/3p1eLGX1Hs","La muerte del bebé se registró en El Fortín, noroeste de #Guayaquil » https://t.co/q5o0drovML https://t.co/3p1eLGX1Hs",FALSE,,"<a href=""https://about.twitter.com/products/tweetdeck"" rel=""nofollow"">TweetDeck</a>",NA,NA,NA,NA,NA,,,,NA,FALSE,11,42,FALSE,NA,FALSE,NA,es,FALSE,NA,93,NA,,NA,NA,NA,NA,NA,NA,NA,NA,NA,NA,NA,NA,NA
elcomerciocom,2023-02-02T23:10:00Z,1621284830184079400,1621284830184079361,Programa Reactiva Turismo otorgará créditos de hasta USD 20 000 https://t.co/jTMWohtz1H,Programa Reactiva Turismo otorgará créditos de hasta USD 20 000 https://t.co/jTMWohtz1H,FALSE,,"<a href=""https://about.twitter.com/products/tweetdeck"" rel=""nofollow"">TweetDeck</a>",NA,NA,NA,NA,NA,,,,NA,FALSE,2,4,FALSE,NA,FALSE,NA,es,FALSE,NA,87,NA,,NA,NA,NA,NA,NA,NA,NA,NA,NA,NA,NA,NA,NA
elcomerciocom,2023-02-02T22:30:00Z,1621274767100887e3,1621274767100887040,El volcán #Cotopaxi registra una columna de gas y ceniza de una altura de 2 500 metros sobre el nivel del cráter » https://t.co/IwLWYQmemZ https://t.co/RyNEmRQWvt,El volcán #Cotopaxi registra una columna de gas y ceniza de una altura de 2 500 metros sobre el nivel del cráter » https://t.co/IwLWYQmemZ https://t.co/RyNEmRQWvt,FALSE,,"<a href=""https://about.twitter.com/products/tweetdeck"" rel=""nofollow"">TweetDeck</a>",NA,NA,NA,NA,NA,,,,NA,FALSE,8,36,FALSE,NA,FALSE,NA,es,FALSE,NA,138,NA,,NA,NA,NA,NA,NA,NA,NA,NA,NA,NA,NA,NA,NA
elcomerciocom,2023-02-02T22:21:00Z,1621272499131486200,1621272499131486211,El padre también intentó cruzar el río pero se ahogó » https://t.co/P3iehVUu0W https://t.co/rqnUUpq4di,El padre también intentó cruzar el río pero se ahogó » https://t.co/P3iehVUu0W https://t.co/rqnUUpq4di,FALSE,,"<a href=""https://about.twitter.com/products/tweetdeck"" rel=""nofollow"">TweetDeck</a>",NA,NA,NA,NA,NA,,,,NA,FALSE,6,33,FALSE,NA,FALSE,NA,es,FALSE,NA,78,NA,,NA,NA,NA,NA,NA,NA,NA,NA,NA,NA,NA,NA,NA
elcomerciocom,2023-02-02T21:50:40Z,1621264866827767800,1621264866827767809,Omar Cevallos anunció que ha coincidido con Pedro José #Freile en las propuestas y le dio su “voto de confianza” » https://t.co/hliMXvywPD https://t.co/IJp0u1lYRy,Omar Cevallos anunció que ha coincidido con Pedro José #Freile en las propuestas y le dio su “voto de confianza” » https://t.co/hliMXvywPD https://t.co/IJp0u1lYRy,FALSE,,"<a href=""https://about.twitter.com/products/tweetdeck"" rel=""nofollow"">TweetDeck</a>",NA,NA,NA,NA,NA,,,,NA,FALSE,10,59,FALSE,NA,FALSE,NA,es,FALSE,NA,138,NA,,NA,NA,NA,NA,NA,NA,NA,NA,NA,NA,NA,NA,NA
elcomerciocom,2023-02-02T21:24:20Z,1621258238564991e3,1621258238564990976,La #Fiscalía apelará a esta decisión » https://t.co/GyfzX3ZmJW https://t.co/IMwpIKvxrj,La #Fiscalía apelará a esta decisión » https://t.co/GyfzX3ZmJW https://t.co/IMwpIKvxrj,FALSE,,"<a href=""https://about.twitter.com/products/tweetdeck"" rel=""nofollow"">TweetDeck</a>",NA,NA,NA,NA,NA,,,,NA,FALSE,6,29,FALSE,NA,FALSE,NA,es,FALSE,NA,62,NA,,NA,NA,NA,NA,NA,NA,NA,NA,NA,NA,NA,NA,NA
elcomerciocom,2023-02-02T19:00:00Z,1621221917469335600,1621221917469335552,"Sol y lluvias habrá el día de elecciones, según pronóstico https://t.co/b3wJNCd7O6","Sol y lluvias habrá el día de elecciones, según pronóstico https://t.co/b3wJNCd7O6",FALSE,,"<a href=""https://mobile.twitter.com"" rel=""nofollow"">Twitter Web App</a>",NA,NA,NA,NA,NA,,,,NA,FALSE,2,4,FALSE,NA,FALSE,NA,es,FALSE,NA,82,NA,,NA,NA,NA,NA,NA,NA,NA,NA,NA,NA,NA,NA,NA
elcomerciocom,2023-02-02T18:58:10Z,1621221454330069e3,1621221454330068992,#Quito | La Dinased revela detalles sobre el hallazgo del cuerpo sin vida en el parque Metropolitano del Sur » https://t.co/5GArWx1jmD https://t.co/lGWrI0HHVm,#Quito | La Dinased revela detalles sobre el hallazgo del cuerpo sin vida en el parque Metropolitano del Sur » https://t.co/5GArWx1jmD https://t.co/lGWrI0HHVm,FALSE,,"<a href=""https://mobile.twitter.com"" rel=""nofollow"">Twitter Web App</a>",NA,NA,NA,NA,NA,,,,NA,FALSE,7,43,FALSE,NA,FALSE,NA,es,FALSE,NA,134,NA,,NA,NA,NA,NA,NA,NA,NA,NA,NA,NA,NA,NA,NA
elcomerciocom,2023-02-02T18:52:52Z,1621220119937532e3,1621220119937531904,#Video | #Shakira está de cumpleaños este 2 de febrero. Carlos Vives la sorprendió » https://t.co/OnghBWF7Gg https://t.co/lFpCyefP8E,#Video | #Shakira está de cumpleaños este 2 de febrero. Carlos Vives la sorprendió » https://t.co/OnghBWF7Gg https://t.co/lFpCyefP8E,FALSE,,"<a href=""https://mobile.twitter.com"" rel=""nofollow"">Twitter Web App</a>",NA,NA,NA,NA,NA,,,,NA,FALSE,18,160,FALSE,NA,FALSE,NA,es,FALSE,NA,108,NA,,NA,NA,NA,NA,NA,NA,NA,NA,NA,NA,NA,NA,NA
elcomerciocom,2023-02-02T17:58:52Z,1621206530753183700,1621206530753183749,"Tres detenidos tras balacera en Socio Vivienda, en Guayaquil https://t.co/GNxgL97Hb4","Tres detenidos tras balacera en Socio Vivienda, en Guayaquil https://t.co/GNxgL97Hb4",FALSE,,"<a href=""https://mobile.twitter.com"" rel=""nofollow"">Twitter Web App</a>",NA,NA,NA,NA,NA,,,,NA,FALSE,2,5,FALSE,NA,FALSE,NA,es,FALSE,NA,84,NA,,NA,NA,NA,NA,NA,NA,NA,NA,NA,NA,NA,NA,NA
elcomerciocom,2023-02-02T17:52:07Z,1621204832907415600,1621204832907415553,El DT Gustavo Alfaro terminó su contrato con #Ecuador luego del Mundial de #Qatar2022 » https://t.co/1FsuQ31xH1 https://t.co/M1oOpG5wat,El DT Gustavo Alfaro terminó su contrato con #Ecuador luego del Mundial de #Qatar2022 » https://t.co/1FsuQ31xH1 https://t.co/M1oOpG5wat,FALSE,,"<a href=""https://mobile.twitter.com"" rel=""nofollow"">Twitter Web App</a>",NA,NA,NA,NA,NA,,,,NA,FALSE,6,24,FALSE,NA,FALSE,NA,es,FALSE,NA,111,NA,,NA,NA,NA,NA,NA,NA,NA,NA,NA,NA,NA,NA,NA
elcomerciocom,2023-02-02T17:48:22Z,1621203888220037e3,1621203888220037122,En #Quito están habilitados seis centros para la revisión técnica vehicular. Conozca cómo realizar el proceso » https://t.co/ACJiCnifU1 https://t.co/8XAlsDz1Ci,En #Quito están habilitados seis centros para la revisión técnica vehicular. Conozca cómo realizar el proceso » https://t.co/ACJiCnifU1 https://t.co/8XAlsDz1Ci,FALSE,,"<a href=""https://mobile.twitter.com"" rel=""nofollow"">Twitter Web App</a>",NA,NA,NA,NA,NA,,,,NA,FALSE,3,12,FALSE,NA,FALSE,NA,es,FALSE,NA,135,NA,,NA,NA,NA,NA,NA,NA,NA,NA,NA,NA,NA,NA,NA
elcomerciocom,2023-02-02T17:39:05Z,1621201552374382600,1621201552374382594,La jornada de descanso se debe al pedido del #CNE por las #EleccionesEC2023 » https://t.co/0SKAgtvbol https://t.co/AdQl6mNvKx,La jornada de descanso se debe al pedido del #CNE por las #EleccionesEC2023 » https://t.co/0SKAgtvbol https://t.co/AdQl6mNvKx,FALSE,,"<a href=""https://mobile.twitter.com"" rel=""nofollow"">Twitter Web App</a>",NA,NA,NA,NA,NA,,,,NA,FALSE,10,42,FALSE,NA,FALSE,NA,es,FALSE,NA,101,NA,,NA,NA,NA,NA,NA,NA,NA,NA,NA,NA,NA,NA,NA
elcomerciocom,2023-02-02T17:38:26Z,1621201391954919400,1621201391954919427,Bancos atenderán en horario diferido durante el feriado por elecciones https://t.co/ANka3wYpjz,Bancos atenderán en horario diferido durante el feriado por elecciones https://t.co/ANka3wYpjz,FALSE,,"<a href=""https://mobile.twitter.com"" rel=""nofollow"">Twitter Web App</a>",NA,NA,NA,NA,NA,,,,NA,FALSE,2,2,FALSE,NA,FALSE,NA,es,FALSE,NA,94,NA,,NA,NA,NA,NA,NA,NA,NA,NA,NA,NA,NA,NA,NA
elcomerciocom,2023-02-02T17:26:20Z,1621198344537219e3,1621198344537219074,Gustavo Alfaro reclama más de USD 2 millones a la FEF https://t.co/uj6zbGQJSo,Gustavo Alfaro reclama más de USD 2 millones a la FEF https://t.co/uj6zbGQJSo,FALSE,,"<a href=""https://mobile.twitter.com"" rel=""nofollow"">Twitter Web App</a>",NA,NA,NA,NA,NA,,,,NA,FALSE,6,10,FALSE,NA,FALSE,NA,es,FALSE,NA,77,NA,,NA,NA,NA,NA,NA,NA,NA,NA,NA,NA,NA,NA,NA
elcomerciocom,2023-02-02T17:13:32Z,1621195125677326300,1621195125677326342,Audiencia de juicio en caso Sebastián Yunda culmina en Quito https://t.co/6TAlaSI9h8,Audiencia de juicio en caso Sebastián Yunda culmina en Quito https://t.co/6TAlaSI9h8,FALSE,,"<a href=""https://mobile.twitter.com"" rel=""nofollow"">Twitter Web App</a>",NA,NA,NA,NA,NA,,,,NA,FALSE,4,5,FALSE,NA,FALSE,NA,es,FALSE,NA,84,NA,,NA,NA,NA,NA,NA,NA,NA,NA,NA,NA,NA,NA,NA
elcomerciocom,2023-02-02T17:13:02Z,1621194999797801e3,1621194999797801019,"Desde el lunes 23 de enero, los 18 trenes del #MetroDeQuito comenzaron a circular con pasajeros » https://t.co/dYBbIhmoy8 https://t.co/CBA2djNjI5","Desde el lunes 23 de enero, los 18 trenes del #MetroDeQuito comenzaron a circular con pasajeros » https://t.co/dYBbIhmoy8 https://t.co/CBA2djNjI5",FALSE,,"<a href=""https://mobile.twitter.com"" rel=""nofollow"">Twitter Web App</a>",NA,NA,NA,NA,NA,,,,NA,FALSE,7,13,FALSE,NA,FALSE,NA,es,FALSE,NA,121,NA,,NA,NA,NA,NA,NA,NA,NA,NA,NA,NA,NA,NA,NA
elcomerciocom,2023-02-02T16:57:35Z,1621191107777372200,1621191107777372161,Un informe señala que los migrantes venezolanos optan para retornar a su país o emprender caminatas hacia EE.UU. » https://t.co/ls2Egv5TMM https://t.co/P4o297DIBw,Un informe señala que los migrantes venezolanos optan para retornar a su país o emprender caminatas hacia EE.UU. » https://t.co/ls2Egv5TMM https://t.co/P4o297DIBw,FALSE,,"<a href=""https://mobile.twitter.com"" rel=""nofollow"">Twitter Web App</a>",NA,NA,NA,NA,NA,,,,NA,FALSE,351,3235,FALSE,NA,FALSE,NA,es,FALSE,NA,138,NA,,NA,NA,NA,NA,NA,NA,NA,NA,NA,NA,NA,NA,NA
