screen_name,created_at,id,id_str,text,full_text,truncated,entities,source,in_reply_to_status_id,in_reply_to_status_id_str,in_reply_to_user_id,in_reply_to_user_id_str,in_reply_to_screen_name,geo,coordinates,place,contributors,is_quote_status,retweet_count,favorite_count,favorited,favorited_by,retweeted,scopes,lang,possibly_sensitive,display_text_width,display_text_range,retweeted_status,quoted_status,quoted_status_id,quoted_status_id_str,quoted_status_permalink,quote_count,timestamp_ms,reply_count,filter_level,metadata,query,withheld_scope,withheld_copyright,withheld_in_countries,possibly_sensitive_appealable
elcomerciocom,2023-01-31T02:30:00Z,1620248000910991400,1620248000910991360,"El #MIES emprendió ""articulaciones legales"" a fin de proteger la integridad física y emocional del menor » https://t.co/IRFOyNt2Si https://t.co/X714FAPl2r","El #MIES emprendió ""articulaciones legales"" a fin de proteger la integridad física y emocional del menor » https://t.co/IRFOyNt2Si https://t.co/X714FAPl2r",FALSE,,"<a href=""https://about.twitter.com/products/tweetdeck"" rel=""nofollow"">TweetDeck</a>",NA,NA,NA,NA,NA,,,,NA,FALSE,11,76,FALSE,NA,FALSE,NA,es,FALSE,NA,130,NA,,NA,NA,NA,NA,NA,NA,NA,NA,NA,NA,NA,NA,NA
elcomerciocom,2023-01-31T02:00:30Z,162024057575569e4,1620240575755689984,"Juez del cantón Santa Rosa, provincia de El Oro, concedió medidas cautelares » https://t.co/RvJdJeIPp1 https://t.co/R5rN9lgKnN","Juez del cantón Santa Rosa, provincia de El Oro, concedió medidas cautelares » https://t.co/RvJdJeIPp1 https://t.co/R5rN9lgKnN",FALSE,,"<a href=""https://about.twitter.com/products/tweetdeck"" rel=""nofollow"">TweetDeck</a>",NA,NA,NA,NA,NA,,,,NA,FALSE,5,12,FALSE,NA,FALSE,NA,es,FALSE,NA,102,NA,,NA,NA,NA,NA,NA,NA,NA,NA,NA,NA,NA,NA,NA
elcomerciocom,2023-01-31T02:00:01Z,1620240454804439e3,1620240454804439041,"Una nueva demanda recae sobre el cantante de rock Marilyn Manson, en la que se acusa de agresión sexual a una menor. » https://t.co/96M800bSdu https://t.co/G12wSp1A1B","Una nueva demanda recae sobre el cantante de rock Marilyn Manson, en la que se acusa de agresión sexual a una menor. » https://t.co/96M800bSdu https://t.co/G12wSp1A1B",FALSE,,"<a href=""https://about.twitter.com/products/tweetdeck"" rel=""nofollow"">TweetDeck</a>",NA,NA,NA,NA,NA,,,,NA,FALSE,1,13,FALSE,NA,FALSE,NA,es,FALSE,NA,142,NA,,NA,NA,NA,NA,NA,NA,NA,NA,NA,NA,NA,NA,NA
elcomerciocom,2023-01-31T01:30:30Z,1620233026687967200,1620233026687967232,¿Hasta cuándo serán las capacitaciones del #CNE? » https://t.co/dawpkXOHOw https://t.co/2nGi2MvbC2,¿Hasta cuándo serán las capacitaciones del #CNE? » https://t.co/dawpkXOHOw https://t.co/2nGi2MvbC2,FALSE,,"<a href=""https://about.twitter.com/products/tweetdeck"" rel=""nofollow"">TweetDeck</a>",NA,NA,NA,NA,NA,,,,NA,FALSE,4,8,FALSE,NA,FALSE,NA,es,FALSE,NA,74,NA,,NA,NA,NA,NA,NA,NA,NA,NA,NA,NA,NA,NA,NA
elcomerciocom,2023-01-31T01:13:10Z,1620228662279929900,1620228662279929856,"| INFORME ESPECIAL | El 2022 cerró con 200 alertas de inseguridad en escuelas. Guayaquil, Durán y Samborondón concentran más casos. Faltan denuncias » https://t.co/10ANVJKpEU https://t.co/q1OYPjzE38","| INFORME ESPECIAL | El 2022 cerró con 200 alertas de inseguridad en escuelas. Guayaquil, Durán y Samborondón concentran más casos. Faltan denuncias » https://t.co/10ANVJKpEU https://t.co/q1OYPjzE38",FALSE,,"<a href=""https://mobile.twitter.com"" rel=""nofollow"">Twitter Web App</a>",NA,NA,NA,NA,NA,,,,NA,FALSE,16,36,FALSE,NA,FALSE,NA,es,FALSE,NA,174,NA,,NA,NA,NA,NA,NA,NA,NA,NA,NA,NA,NA,NA,NA
elcomerciocom,2023-01-31T01:00:00Z,1620225350587371500,1620225350587371521,En estos puntos de atención en #Quito se vacunará a la población a partir de los tres años de edad » https://t.co/6w9UsYZXMV https://t.co/XtYGKihR65,En estos puntos de atención en #Quito se vacunará a la población a partir de los tres años de edad » https://t.co/6w9UsYZXMV https://t.co/XtYGKihR65,FALSE,,"<a href=""https://about.twitter.com/products/tweetdeck"" rel=""nofollow"">TweetDeck</a>",NA,NA,NA,NA,NA,,,,NA,FALSE,6,28,FALSE,NA,FALSE,NA,es,FALSE,NA,124,NA,,NA,NA,NA,NA,NA,NA,NA,NA,NA,NA,NA,NA,NA
elcomerciocom,2023-01-31T00:32:00Z,1620218302713811e3,1620218302713810944,Trole y Ecovía se conectarán con el #MetrodeQuito » https://t.co/HLQovag2G2,Trole y Ecovía se conectarán con el #MetrodeQuito » https://t.co/HLQovag2G2,FALSE,,"<a href=""https://about.twitter.com/products/tweetdeck"" rel=""nofollow"">TweetDeck</a>",NA,NA,NA,NA,NA,,,,NA,FALSE,2,13,FALSE,NA,FALSE,NA,es,FALSE,NA,75,NA,,NA,NA,NA,NA,NA,NA,NA,NA,NA,NA,NA,NA,NA
elcomerciocom,2023-01-31T00:00:02Z,1620210258844024800,1620210258844024836,Dos hombres armados dispararon en contra de jueza de #Manabí y su secretario mientras almorzaban » https://t.co/XPTIu6uWl0 https://t.co/i3YI1hLzhp,Dos hombres armados dispararon en contra de jueza de #Manabí y su secretario mientras almorzaban » https://t.co/XPTIu6uWl0 https://t.co/i3YI1hLzhp,FALSE,,"<a href=""https://about.twitter.com/products/tweetdeck"" rel=""nofollow"">TweetDeck</a>",NA,NA,NA,NA,NA,,,,NA,FALSE,9,35,FALSE,NA,FALSE,NA,es,FALSE,NA,122,NA,,NA,NA,NA,NA,NA,NA,NA,NA,NA,NA,NA,NA,NA
elcomerciocom,2023-01-30T23:30:00Z,1620202701874151400,1620202701874151430,#EleccionesEc2023 | El consumo de bebidas alcohólicas está prohibido desde este día y hora » https://t.co/Zvc7yhAccW https://t.co/y75N5ApEHm,#EleccionesEc2023 | El consumo de bebidas alcohólicas está prohibido desde este día y hora » https://t.co/Zvc7yhAccW https://t.co/y75N5ApEHm,FALSE,,"<a href=""https://about.twitter.com/products/tweetdeck"" rel=""nofollow"">TweetDeck</a>",NA,NA,NA,NA,NA,,,,NA,FALSE,9,47,FALSE,NA,FALSE,NA,es,FALSE,NA,116,NA,,NA,NA,NA,NA,NA,NA,NA,NA,NA,NA,NA,NA,NA
elcomerciocom,2023-01-30T23:00:00Z,1620195152688988200,1620195152688988163,"Muere Lisa Loring, la primera Merlina en 'La familia Addams' de 1964 »  https://t.co/rgKnsyuDL2 https://t.co/5lWoxKHWHI","Muere Lisa Loring, la primera Merlina en 'La familia Addams' de 1964 »  https://t.co/rgKnsyuDL2 https://t.co/5lWoxKHWHI",FALSE,,"<a href=""https://about.twitter.com/products/tweetdeck"" rel=""nofollow"">TweetDeck</a>",NA,NA,NA,NA,NA,,,,NA,FALSE,30,144,FALSE,NA,FALSE,NA,es,FALSE,NA,95,NA,,NA,NA,NA,NA,NA,NA,NA,NA,NA,NA,NA,NA,NA
elcomerciocom,2023-01-30T22:32:53Z,1620188327294177300,1620188327294177280,¿No decides aún tu voto? 🤔🗳️ #SiYoFueraAlcalde te presenta a los candidatos que aspiran a la Alcaldía de #Quito y sus propuestas. Este lunes hablamos con Andrés Páez » https://t.co/gCFuO0ws7S https://t.co/LJ6WOzbE1Y,¿No decides aún tu voto? 🤔🗳️ #SiYoFueraAlcalde te presenta a los candidatos que aspiran a la Alcaldía de #Quito y sus propuestas. Este lunes hablamos con Andrés Páez » https://t.co/gCFuO0ws7S https://t.co/LJ6WOzbE1Y,FALSE,,"<a href=""https://mobile.twitter.com"" rel=""nofollow"">Twitter Web App</a>",NA,NA,NA,NA,NA,,,,NA,FALSE,36,95,FALSE,NA,FALSE,NA,es,FALSE,NA,191,NA,,NA,NA,NA,NA,NA,NA,NA,NA,NA,NA,NA,NA,NA
elcomerciocom,2023-01-30T22:30:30Z,1620187729488187400,1620187729488187393,¿Arsenal o quedarse en Brighton? Dos DT ecuatorianos lo analizan »  https://t.co/Do1yoywRfj https://t.co/CzCBuiIO20,¿Arsenal o quedarse en Brighton? Dos DT ecuatorianos lo analizan »  https://t.co/Do1yoywRfj https://t.co/CzCBuiIO20,FALSE,,"<a href=""https://about.twitter.com/products/tweetdeck"" rel=""nofollow"">TweetDeck</a>",NA,NA,NA,NA,NA,,,,NA,FALSE,4,19,FALSE,NA,FALSE,NA,es,FALSE,NA,91,NA,,NA,NA,NA,NA,NA,NA,NA,NA,NA,NA,NA,NA,NA
elcomerciocom,2023-01-30T22:00:30Z,1620180179208241200,1620180179208241155,"El actor de #Bridgerton fue catalogado como el hombre más lindo del mundo, según la ciencia »  https://t.co/qLIpeUq0fb https://t.co/i5XMXoXH8e","El actor de #Bridgerton fue catalogado como el hombre más lindo del mundo, según la ciencia »  https://t.co/qLIpeUq0fb https://t.co/i5XMXoXH8e",FALSE,,"<a href=""https://about.twitter.com/products/tweetdeck"" rel=""nofollow"">TweetDeck</a>",NA,NA,NA,NA,NA,,,,NA,FALSE,5,30,FALSE,NA,FALSE,NA,es,FALSE,NA,118,NA,,NA,NA,NA,NA,NA,NA,NA,NA,NA,NA,NA,NA,NA
elcomerciocom,2023-01-30T21:30:30Z,1620172626738962400,1620172626738962432,#EleccionesEc2023 | Estos son los pasos para conocer el lugar de votación » https://t.co/15EyCJ5kMf https://t.co/54cPTYrcE4,#EleccionesEc2023 | Estos son los pasos para conocer el lugar de votación » https://t.co/15EyCJ5kMf https://t.co/54cPTYrcE4,FALSE,,"<a href=""https://about.twitter.com/products/tweetdeck"" rel=""nofollow"">TweetDeck</a>",NA,NA,NA,NA,NA,,,,NA,FALSE,9,19,FALSE,NA,FALSE,NA,es,FALSE,NA,99,NA,,NA,NA,NA,NA,NA,NA,NA,NA,NA,NA,NA,NA,NA
elcomerciocom,2023-01-30T20:22:14Z,1620155449247948800,1620155449247948800,#EleccionesEc2023 | Andrés Páez explica su plan de gobierno para la Alcaldía de #Quito en #SiYoFueraAlcalde. Un espacio de EL COMERCIO para dar a conocer las propuestas de los candidatos » https://t.co/gCFuO0vUik https://t.co/umPblegh3c,#EleccionesEc2023 | Andrés Páez explica su plan de gobierno para la Alcaldía de #Quito en #SiYoFueraAlcalde. Un espacio de EL COMERCIO para dar a conocer las propuestas de los candidatos » https://t.co/gCFuO0vUik https://t.co/umPblegh3c,FALSE,,"<a href=""https://about.twitter.com/products/tweetdeck"" rel=""nofollow"">TweetDeck</a>",NA,NA,NA,NA,NA,,,,NA,FALSE,90,315,FALSE,NA,FALSE,NA,es,FALSE,NA,212,NA,,NA,NA,NA,NA,NA,NA,NA,NA,NA,NA,NA,NA,NA
elcomerciocom,2023-01-30T19:15:21Z,1620138616587698200,1620138616587698176,#Video | El DT Luis Zubeldía hizo emocionar a los hinchas de Liga de Quito en la #NocheBlancaAlMediodía » https://t.co/CVLoxIkjFj https://t.co/ziKzLqpwBi,#Video | El DT Luis Zubeldía hizo emocionar a los hinchas de Liga de Quito en la #NocheBlancaAlMediodía » https://t.co/CVLoxIkjFj https://t.co/ziKzLqpwBi,FALSE,,"<a href=""https://mobile.twitter.com"" rel=""nofollow"">Twitter Web App</a>",NA,NA,NA,NA,NA,,,,NA,FALSE,7,58,FALSE,NA,FALSE,NA,es,FALSE,NA,129,NA,,NA,NA,NA,NA,NA,NA,NA,NA,NA,NA,NA,NA,NA
elcomerciocom,2023-01-30T19:06:47Z,1620136460014985200,1620136460014985216,¡Indignante! Mujer agrede vilmente a su hijo en #Ambato. La Policía se pronuncia. #Video » https://t.co/qlmyT9cBp8 https://t.co/nAAspyAMGA,¡Indignante! Mujer agrede vilmente a su hijo en #Ambato. La Policía se pronuncia. #Video » https://t.co/qlmyT9cBp8 https://t.co/nAAspyAMGA,FALSE,,"<a href=""https://mobile.twitter.com"" rel=""nofollow"">Twitter Web App</a>",NA,NA,NA,NA,NA,,,,NA,FALSE,127,668,FALSE,NA,FALSE,NA,es,FALSE,NA,114,NA,,NA,NA,NA,NA,NA,NA,NA,NA,NA,NA,NA,NA,NA
elcomerciocom,2023-01-30T18:40:25Z,1620129825372635100,1620129825372635136,Alves presentó recurso para salir en libertad provisional https://t.co/fsd5sWx2bk,Alves presentó recurso para salir en libertad provisional https://t.co/fsd5sWx2bk,FALSE,,"<a href=""https://mobile.twitter.com"" rel=""nofollow"">Twitter Web App</a>",NA,NA,NA,NA,NA,,,,NA,FALSE,3,3,FALSE,NA,FALSE,NA,es,FALSE,NA,81,NA,,NA,NA,NA,NA,NA,NA,NA,NA,NA,NA,NA,NA,NA
elcomerciocom,2023-01-30T18:39:52Z,1620129685240955e3,1620129685240954880,Luis Zubeldía besó césped de estadio Rodrigo Paz https://t.co/CwzZeu7ZBZ,Luis Zubeldía besó césped de estadio Rodrigo Paz https://t.co/CwzZeu7ZBZ,FALSE,,"<a href=""https://mobile.twitter.com"" rel=""nofollow"">Twitter Web App</a>",NA,NA,NA,NA,NA,,,,NA,FALSE,3,9,FALSE,NA,FALSE,NA,es,FALSE,NA,72,NA,,NA,NA,NA,NA,NA,NA,NA,NA,NA,NA,NA,NA,NA
elcomerciocom,2023-01-30T18:30:37Z,1620127357167362e3,1620127357167362048,#Quito | Sargento fue hallado entre lodo y pedazos viejos de madera. La Unidad de Bienestar Animal rescató al perro » https://t.co/a25RqZIR7x https://t.co/rRQEr2cAaE,#Quito | Sargento fue hallado entre lodo y pedazos viejos de madera. La Unidad de Bienestar Animal rescató al perro » https://t.co/a25RqZIR7x https://t.co/rRQEr2cAaE,FALSE,,"<a href=""https://mobile.twitter.com"" rel=""nofollow"">Twitter Web App</a>",NA,NA,NA,NA,NA,,,,NA,FALSE,80,609,FALSE,NA,FALSE,NA,es,FALSE,NA,141,NA,,NA,NA,NA,NA,NA,NA,NA,NA,NA,NA,NA,NA,NA
elcomerciocom,2023-01-30T18:25:16Z,1620126011965993e3,1620126011965992960,#Video | Un pasajero recibió disparos al intentar detener a los sospechosos. El hecho ocurrió en Guayaquil » https://t.co/69PPRxggb5 https://t.co/Jr4PHTmD6v,#Video | Un pasajero recibió disparos al intentar detener a los sospechosos. El hecho ocurrió en Guayaquil » https://t.co/69PPRxggb5 https://t.co/Jr4PHTmD6v,FALSE,,"<a href=""https://mobile.twitter.com"" rel=""nofollow"">Twitter Web App</a>",NA,NA,NA,NA,NA,,,,NA,FALSE,13,43,FALSE,NA,FALSE,NA,es,FALSE,NA,132,NA,,NA,NA,NA,NA,NA,NA,NA,NA,NA,NA,NA,NA,NA
elcomerciocom,2023-01-30T18:01:25Z,1620120008901918700,1620120008901918721,"#Asamblea | Ronny Aleaga se refiere a su participación en una fiesta en una piscina en Miami con personas requeridas por la Justicia. ""Me fui a un viaje familiar. Asistí a varias actividades (...) una reunión familiar de un tío de mi novia"".

Vía: @rgrvelez https://t.co/M8p9P44ONE","#Asamblea | Ronny Aleaga se refiere a su participación en una fiesta en una piscina en Miami con personas requeridas por la Justicia. ""Me fui a un viaje familiar. Asistí a varias actividades (...) una reunión familiar de un tío de mi novia"".

Vía: @rgrvelez https://t.co/M8p9P44ONE",FALSE,,"<a href=""https://mobile.twitter.com"" rel=""nofollow"">Twitter Web App</a>",1620119688369025e3,1620119688369025024,14333756,14333756,elcomerciocom,,,,NA,FALSE,4,1,FALSE,NA,FALSE,NA,es,FALSE,NA,257,NA,,NA,NA,NA,NA,NA,NA,NA,NA,NA,NA,NA,NA,NA
elcomerciocom,2023-01-30T18:00:08Z,1620119688369025e3,1620119688369025024,"#Asamblea | Rodrigo Fajardo (ID), integrante de la Comisión del #CasoEncuentro, cuestiona que la mesa abra comparecencias con Ronny Aleaga como primer invitado.

Vía: @rgrvelez https://t.co/DVqdhYo9Oo","#Asamblea | Rodrigo Fajardo (ID), integrante de la Comisión del #CasoEncuentro, cuestiona que la mesa abra comparecencias con Ronny Aleaga como primer invitado.

Vía: @rgrvelez https://t.co/DVqdhYo9Oo",FALSE,,"<a href=""https://mobile.twitter.com"" rel=""nofollow"">Twitter Web App</a>",1620107029691109400,1620107029691109376,14333756,14333756,elcomerciocom,,,,NA,FALSE,4,3,FALSE,NA,FALSE,NA,es,FALSE,NA,176,NA,,NA,NA,NA,NA,NA,NA,NA,NA,NA,NA,NA,NA,NA
elcomerciocom,2023-01-30T17:09:50Z,1620107029691109400,1620107029691109376,"#Asamblea | El legislador Ronny Aleaga se presenta a la Comisión Legislativa del #CasoEncuentro y rechaza acusaciones hechas por Leonardo Cortazar, operador externo de eléctricas, sobre supuesto financiamiento a su campaña.

Vía: @rgrvelez https://t.co/VFV2NujYJA","#Asamblea | El legislador Ronny Aleaga se presenta a la Comisión Legislativa del #CasoEncuentro y rechaza acusaciones hechas por Leonardo Cortazar, operador externo de eléctricas, sobre supuesto financiamiento a su campaña.

Vía: @rgrvelez https://t.co/VFV2NujYJA",FALSE,,"<a href=""https://mobile.twitter.com"" rel=""nofollow"">Twitter Web App</a>",NA,NA,NA,NA,NA,,,,NA,FALSE,19,30,FALSE,NA,FALSE,NA,es,FALSE,NA,239,NA,,NA,NA,NA,NA,NA,NA,NA,NA,NA,NA,NA,NA,NA
elcomerciocom,2023-01-30T16:45:39Z,162010094492203e4,1620100944922030083,#ATENCIÓN | AMT informa que usuarios pueden revisar valores de revisión y matriculación vehicular en #Quito. ¿Turnos? » https://t.co/xclnhbYz7K https://t.co/hoWj5FVBGv,#ATENCIÓN | AMT informa que usuarios pueden revisar valores de revisión y matriculación vehicular en #Quito. ¿Turnos? » https://t.co/xclnhbYz7K https://t.co/hoWj5FVBGv,FALSE,,"<a href=""https://mobile.twitter.com"" rel=""nofollow"">Twitter Web App</a>",NA,NA,NA,NA,NA,,,,NA,FALSE,4,35,FALSE,NA,FALSE,NA,es,FALSE,NA,143,NA,,NA,NA,NA,NA,NA,NA,NA,NA,NA,NA,NA,NA,NA
elcomerciocom,2023-01-30T16:38:46Z,1620099210413752300,1620099210413752323,La emisión de #ceniza del volcán #Cotopaxi registra incremento significativo este lunes 30 de enero de 2023 » https://t.co/V6LvhcnoVB https://t.co/2J0jrrpYP2,La emisión de #ceniza del volcán #Cotopaxi registra incremento significativo este lunes 30 de enero de 2023 » https://t.co/V6LvhcnoVB https://t.co/2J0jrrpYP2,FALSE,,"<a href=""https://mobile.twitter.com"" rel=""nofollow"">Twitter Web App</a>",NA,NA,NA,NA,NA,,,,NA,FALSE,8,46,FALSE,NA,FALSE,NA,es,FALSE,NA,133,NA,,NA,NA,NA,NA,NA,NA,NA,NA,NA,NA,NA,NA,NA
elcomerciocom,2023-01-30T16:33:38Z,1620097917796352e3,1620097917796352000,Los sospechosos amenazaron a un guardia del estadio Monumental. Esta es la suma que se llevaron » https://t.co/5W6Wm8rrhC https://t.co/mDuSjXuhHZ,Los sospechosos amenazaron a un guardia del estadio Monumental. Esta es la suma que se llevaron » https://t.co/5W6Wm8rrhC https://t.co/mDuSjXuhHZ,FALSE,,"<a href=""https://mobile.twitter.com"" rel=""nofollow"">Twitter Web App</a>",NA,NA,NA,NA,NA,,,,NA,FALSE,103,274,FALSE,NA,FALSE,NA,es,FALSE,NA,121,NA,,NA,NA,NA,NA,NA,NA,NA,NA,NA,NA,NA,NA,NA
elcomerciocom,2023-01-30T15:28:47Z,1620081598732599300,1620081598732599297,Cae ceniza del volcán Cotopaxi en Mulaló https://t.co/rknUDRuk42,Cae ceniza del volcán Cotopaxi en Mulaló https://t.co/rknUDRuk42,FALSE,,"<a href=""https://mobile.twitter.com"" rel=""nofollow"">Twitter Web App</a>",NA,NA,NA,NA,NA,,,,NA,FALSE,2,7,FALSE,NA,FALSE,NA,es,FALSE,NA,64,NA,,NA,NA,NA,NA,NA,NA,NA,NA,NA,NA,NA,NA,NA
elcomerciocom,2023-01-30T15:27:36Z,1620081299984875500,1620081299984875520,#Arsenal quiere a Moisés Caicedo sí o sí. Esta es la cifra récord que está dispuesto a pagar » https://t.co/LJdkDi8yTS https://t.co/aQagvvdCvv,#Arsenal quiere a Moisés Caicedo sí o sí. Esta es la cifra récord que está dispuesto a pagar » https://t.co/LJdkDi8yTS https://t.co/aQagvvdCvv,FALSE,,"<a href=""https://mobile.twitter.com"" rel=""nofollow"">Twitter Web App</a>",NA,NA,NA,NA,NA,,,,NA,FALSE,9,71,FALSE,NA,FALSE,NA,es,FALSE,NA,118,NA,,NA,NA,NA,NA,NA,NA,NA,NA,NA,NA,NA,NA,NA
elcomerciocom,2023-01-30T15:04:22Z,1620075453456457700,1620075453456457730,"#Quito | El 31 de enero del 2022, un #aluvión arrasó con todo lo que encontró a su paso en #LaComuna y #LaGasca. https://t.co/dwcX91pCH9","#Quito | El 31 de enero del 2022, un #aluvión arrasó con todo lo que encontró a su paso en #LaComuna y #LaGasca. https://t.co/dwcX91pCH9",FALSE,,"<a href=""https://mobile.twitter.com"" rel=""nofollow"">Twitter Web App</a>",NA,NA,NA,NA,NA,,,,NA,FALSE,5,22,FALSE,NA,FALSE,NA,es,FALSE,NA,112,NA,,NA,NA,NA,NA,NA,NA,NA,NA,NA,NA,NA,NA,NA
elcomerciocom,2023-01-30T14:57:37Z,1620073756092928e3,1620073756092928000,La Unidad de Bienestar Animal de #Quito reacciona por caso de maltrato animal en #Guamaní » https://t.co/pnNqfWxnvR https://t.co/rhnxnpbLmx,La Unidad de Bienestar Animal de #Quito reacciona por caso de maltrato animal en #Guamaní » https://t.co/pnNqfWxnvR https://t.co/rhnxnpbLmx,FALSE,,"<a href=""https://mobile.twitter.com"" rel=""nofollow"">Twitter Web App</a>",NA,NA,NA,NA,NA,,,,NA,FALSE,15,64,FALSE,NA,FALSE,NA,es,FALSE,NA,115,NA,,NA,NA,NA,NA,NA,NA,NA,NA,NA,NA,NA,NA,NA
elcomerciocom,2023-01-30T14:12:27Z,1620062388719607800,1620062388719607808,"Vehículo pesado se impacta en la vía #Papallacta, en el suroriente de #Quito » https://t.co/Ih3ENGiJ1k https://t.co/WPdeQqcJi1","Vehículo pesado se impacta en la vía #Papallacta, en el suroriente de #Quito » https://t.co/Ih3ENGiJ1k https://t.co/WPdeQqcJi1",FALSE,,"<a href=""https://mobile.twitter.com"" rel=""nofollow"">Twitter Web App</a>",NA,NA,NA,NA,NA,,,,NA,FALSE,3,13,FALSE,NA,FALSE,NA,es,FALSE,NA,102,NA,,NA,NA,NA,NA,NA,NA,NA,NA,NA,NA,NA,NA,NA
elcomerciocom,2023-01-30T13:26:45Z,1620050889427009500,1620050889427009536,El Instituto Nacional Mejía de #Quito se consagró campeón de la Superliga Estudiantil » https://t.co/SSq6Rixspc https://t.co/Vhw5qsvBkX,El Instituto Nacional Mejía de #Quito se consagró campeón de la Superliga Estudiantil » https://t.co/SSq6Rixspc https://t.co/Vhw5qsvBkX,FALSE,,"<a href=""https://mobile.twitter.com"" rel=""nofollow"">Twitter Web App</a>",NA,NA,NA,NA,NA,,,,NA,FALSE,24,153,FALSE,NA,FALSE,NA,es,FALSE,NA,111,NA,,NA,NA,NA,NA,NA,NA,NA,NA,NA,NA,NA,NA,NA
elcomerciocom,2023-01-30T12:19:36Z,1620033988764274700,1620033988764274690,Decenas de fallecidos por ataque a una #mezquita en #Pakistán. Equipos de rescate buscan a personas atrapadas » https://t.co/8yutYmLXSd https://t.co/Lkfbm5dYv4,Decenas de fallecidos por ataque a una #mezquita en #Pakistán. Equipos de rescate buscan a personas atrapadas » https://t.co/8yutYmLXSd https://t.co/Lkfbm5dYv4,FALSE,,"<a href=""https://mobile.twitter.com"" rel=""nofollow"">Twitter Web App</a>",NA,NA,NA,NA,NA,,,,NA,FALSE,9,52,FALSE,NA,FALSE,NA,es,FALSE,NA,135,NA,,NA,NA,NA,NA,NA,NA,NA,NA,NA,NA,NA,NA,NA
elcomerciocom,2023-01-30T12:17:27Z,1620033450169503700,1620033450169503747,Revise el pronóstico del clima en #Ecuador para este lunes 30 de enero » https://t.co/B2zUf4kBoz https://t.co/LTd9PPjDeg,Revise el pronóstico del clima en #Ecuador para este lunes 30 de enero » https://t.co/B2zUf4kBoz https://t.co/LTd9PPjDeg,FALSE,,"<a href=""https://mobile.twitter.com"" rel=""nofollow"">Twitter Web App</a>",NA,NA,NA,NA,NA,,,,NA,FALSE,2,31,FALSE,NA,FALSE,NA,es,FALSE,NA,96,NA,,NA,NA,NA,NA,NA,NA,NA,NA,NA,NA,NA,NA,NA
elcomerciocom,2023-01-30T11:39:56Z,1620024006039707600,1620024006039707648,China asegura que no experimentó un repunte de covid-19 en fiestas de Año Nuevo https://t.co/iw0sxQVt2y,China asegura que no experimentó un repunte de covid-19 en fiestas de Año Nuevo https://t.co/iw0sxQVt2y,FALSE,,"<a href=""https://mobile.twitter.com"" rel=""nofollow"">Twitter Web App</a>",NA,NA,NA,NA,NA,,,,NA,FALSE,4,17,FALSE,NA,FALSE,NA,es,FALSE,NA,103,NA,,NA,NA,NA,NA,NA,NA,NA,NA,NA,NA,NA,NA,NA
elcomerciocom,2023-01-30T11:39:28Z,1620023890956415e3,1620023890956414976,Nube de gases y ceniza se registra en el volcán #Cotopaxi la mañana de este lunes 30 de enero » https://t.co/AG6wa1L27C https://t.co/wgGQyIa24S,Nube de gases y ceniza se registra en el volcán #Cotopaxi la mañana de este lunes 30 de enero » https://t.co/AG6wa1L27C https://t.co/wgGQyIa24S,FALSE,,"<a href=""https://mobile.twitter.com"" rel=""nofollow"">Twitter Web App</a>",NA,NA,NA,NA,NA,,,,NA,FALSE,30,117,FALSE,NA,FALSE,NA,es,FALSE,NA,119,NA,,NA,NA,NA,NA,NA,NA,NA,NA,NA,NA,NA,NA,NA
elcomerciocom,2023-01-30T11:27:50Z,1620020960714961e3,1620020960714960897,Restricciones por el #Picoyplaca para este lunes 30 de enero del 2023 » https://t.co/kZbqkF5MUr https://t.co/44HRj4Zk5A,Restricciones por el #Picoyplaca para este lunes 30 de enero del 2023 » https://t.co/kZbqkF5MUr https://t.co/44HRj4Zk5A,FALSE,,"<a href=""https://mobile.twitter.com"" rel=""nofollow"">Twitter Web App</a>",NA,NA,NA,NA,NA,,,,NA,FALSE,6,20,FALSE,NA,FALSE,NA,es,FALSE,NA,95,NA,,NA,NA,NA,NA,NA,NA,NA,NA,NA,NA,NA,NA,NA
elcomerciocom,2023-01-30T02:23:09Z,1619883885936136200,1619883885936136192,La pelea por 'Moi' en horas clave: El #Brighton recibió otra oferta millonaria por Moisés Caicedo » https://t.co/1Hk3FFy5EM https://t.co/YD3JESD4kf,La pelea por 'Moi' en horas clave: El #Brighton recibió otra oferta millonaria por Moisés Caicedo » https://t.co/1Hk3FFy5EM https://t.co/YD3JESD4kf,FALSE,,"<a href=""https://mobile.twitter.com"" rel=""nofollow"">Twitter Web App</a>",NA,NA,NA,NA,NA,,,,NA,FALSE,13,126,FALSE,NA,FALSE,NA,es,FALSE,NA,123,NA,,NA,NA,NA,NA,NA,NA,NA,NA,NA,NA,NA,NA,NA
elcomerciocom,2023-01-30T02:00:31Z,1619878192520503300,1619878192520503296,"El video, que ya es viral, muestra la reacción de la joven en una fallida primera cita » https://t.co/pAAKvuK0oA https://t.co/aaPXrMAt79","El video, que ya es viral, muestra la reacción de la joven en una fallida primera cita » https://t.co/pAAKvuK0oA https://t.co/aaPXrMAt79",FALSE,,"<a href=""https://about.twitter.com/products/tweetdeck"" rel=""nofollow"">TweetDeck</a>",NA,NA,NA,NA,NA,,,,NA,FALSE,20,160,FALSE,NA,FALSE,NA,es,FALSE,NA,112,NA,,NA,NA,NA,NA,NA,NA,NA,NA,NA,NA,NA,NA,NA
elcomerciocom,2023-01-30T01:00:01Z,1619862966614081500,1619862966614081536,⚠️ No respetar la veda para la reproducción del cangrejo puede salir muy caro » https://t.co/pNej6TRpBE https://t.co/3Xwdr5efDl,⚠️ No respetar la veda para la reproducción del cangrejo puede salir muy caro » https://t.co/pNej6TRpBE https://t.co/3Xwdr5efDl,FALSE,,"<a href=""https://about.twitter.com/products/tweetdeck"" rel=""nofollow"">TweetDeck</a>",NA,NA,NA,NA,NA,,,,NA,FALSE,18,79,FALSE,NA,FALSE,NA,es,FALSE,NA,103,NA,,NA,NA,NA,NA,NA,NA,NA,NA,NA,NA,NA,NA,NA
elcomerciocom,2023-01-30T00:00:30Z,1619847987974250500,1619847987974250496,Se efectuaron allanamientos luego del asesinato múltiple en Daule. Una persona fue detenida » https://t.co/m0L6czQGug https://t.co/Q5biFGDxXp,Se efectuaron allanamientos luego del asesinato múltiple en Daule. Una persona fue detenida » https://t.co/m0L6czQGug https://t.co/Q5biFGDxXp,FALSE,,"<a href=""https://about.twitter.com/products/tweetdeck"" rel=""nofollow"">TweetDeck</a>",NA,NA,NA,NA,NA,,,,NA,FALSE,6,50,FALSE,NA,FALSE,NA,es,FALSE,NA,117,NA,,NA,NA,NA,NA,NA,NA,NA,NA,NA,NA,NA,NA,NA
elcomerciocom,2023-01-29T23:00:30Z,1619832889679532e3,1619832889679532038,#Ecuador | Un interno fue hallado sin vida en el interior de su celda. Autoridades investigan » https://t.co/mqPw75i9H1 https://t.co/qOFyPqMJbQ,#Ecuador | Un interno fue hallado sin vida en el interior de su celda. Autoridades investigan » https://t.co/mqPw75i9H1 https://t.co/qOFyPqMJbQ,FALSE,,"<a href=""https://about.twitter.com/products/tweetdeck"" rel=""nofollow"">TweetDeck</a>",NA,NA,NA,NA,NA,,,,NA,FALSE,11,31,FALSE,NA,FALSE,NA,es,FALSE,NA,119,NA,,NA,NA,NA,NA,NA,NA,NA,NA,NA,NA,NA,NA,NA
elcomerciocom,2023-01-29T21:49:58Z,1619815137942159400,1619815137942159362,Horas de incertidumbre para Moisés Caicedo en el Brighton » https://t.co/9EpOFoaeyv https://t.co/epOYtwvKbA,Horas de incertidumbre para Moisés Caicedo en el Brighton » https://t.co/9EpOFoaeyv https://t.co/epOYtwvKbA,FALSE,,"<a href=""https://about.twitter.com/products/tweetdeck"" rel=""nofollow"">TweetDeck</a>",NA,NA,NA,NA,NA,,,,NA,FALSE,5,78,FALSE,NA,FALSE,NA,es,FALSE,NA,83,NA,,NA,NA,NA,NA,NA,NA,NA,NA,NA,NA,NA,NA,NA
